{
  "schemaVersion": "video-reconstruction-1.0",
  "evidencePack": "evidence/evidence-pack.json",
  "probe": "probe.json",
  "protocol": "capture-protocol.json",
  "scopeStatement": "仅重建 35.067 秒视频内部可见、可听和机器转写内容；页面详情、公开互动数据和外部事实不用于证明视频主张。官方字幕未在页面快照中取得，逐字稿为 Whisper turbo 机器转写，原文不静默修正。",
  "viewerChange": {
    "before": "观众可能把部署 AI 对话网页理解为昂贵、复杂或需要特殊网络。",
    "after": "观众获得一条被作者压缩成 API key、Vercel/GitHub、仓库 Deploy、环境变量和成功页的部署路径；同时能看见视频真正展示的是 Gemini Pro Chat，并知道免费、GPT-4、耗时和无网络/地区限制没有被视频完整证明。"
  },
  "derivedSources": [
    {
      "id": "DS-001",
      "path": "source/transcription/video.json",
      "kind": "machine_transcription",
      "producedBy": "OpenAI Whisper turbo, Chinese, word timestamps enabled",
      "timeRange": {"start":0,"end":35.067},
      "limitations": ["官方字幕不可用", "部署按钮、API key、作者名和口号处有明显 ASR 错词", "逐字稿层保留原始机器输出"]
    },
    {
      "id": "DS-002",
      "path": "audio-evidence/non-speech-classification.json",
      "kind": "audio_carrier_proposals",
      "producedBy": "MIT/ast-finetuned-audioset-10-10-0.4593 gap-free 10s windows",
      "timeRange": {"start":0,"end":35.067},
      "limitations": ["混合音轨机器候选，不隔离语音、音乐与音效", "不能识别曲目、许可、来源或编辑意图"]
    },
    {
      "id": "DS-003",
      "path": "targeted-evidence/ocr-evidence.json",
      "kind": "ocr_proposals_on_267_targeted_frames",
      "producedBy": "macOS Vision OCR after protocol-driven capture",
      "timeRange": {"start":0,"end":35.067},
      "limitations": ["目标帧为 360×640 竖版缩略帧，网页小字误识别较多", "高影响文本已与原始分辨率帧复核"]
    },
    {
      "id": "DS-004",
      "path": "targeted-evidence/highres-manifest.json",
      "kind": "original_resolution_key_frames",
      "producedBy": "ffmpeg extraction at 15 probe-derived times",
      "timeRange": {"start":0,"end":34.62},
      "limitations": ["离散帧不能证明连续操作", "API key 画面存在敏感字符串，重建不复述其值"]
    },
    {
      "id": "DS-005",
      "path": "targeted-evidence/ocr-highres.json",
      "kind": "ocr_proposals_on_original_resolution_key_frames",
      "producedBy": "macOS Vision OCR on 1280×720 key frames",
      "timeRange": {"start":0,"end":34.62},
      "limitations": ["OCR 仍是提案而非原始事实", "低置信文本仅在人工目视一致时使用", "不复述可见 API key"]
    }
  ],
  "transcript": {
    "origin": "machine_transcription: OpenAI Whisper turbo (official page subtitles unavailable)",
    "cues": [
      {"id":"CUE-001","start":0,"end":1.7,"text":"教会你如何白嫖GPT4模型","representativeFrame":"frames/cues/cue-001.jpg","overlappingShots":["SHOT-001","SHOT-002"]},
      {"id":"CUE-002","start":1.7,"end":2.88,"text":"本地部署Gemini","representativeFrame":"frames/cues/cue-002.jpg","overlappingShots":["SHOT-002"]},
      {"id":"CUE-003","start":2.88,"end":3.6,"text":"别怕难","representativeFrame":"frames/cues/cue-003.jpg","overlappingShots":["SHOT-002"]},
      {"id":"CUE-004","start":3.6,"end":5.12,"text":"一分钟的事小白也可以","representativeFrame":"frames/cues/cue-004.jpg","overlappingShots":["SHOT-002","SHOT-003"]},
      {"id":"CUE-005","start":5.12,"end":6.86,"text":"再也不要魔法和二十美刀了","representativeFrame":"frames/cues/cue-005.jpg","overlappingShots":["SHOT-003"]},
      {"id":"CUE-006","start":7.4,"end":8.64,"text":"第一步获取API密钥","representativeFrame":"frames/cues/cue-006.jpg","overlappingShots":["SHOT-003"]},
      {"id":"CUE-007","start":8.64,"end":11.5,"text":"这里谷歌的双子星模型密钥是对大众开放的","representativeFrame":"frames/cues/cue-007.jpg","overlappingShots":["SHOT-003"]},
      {"id":"CUE-008","start":11.5,"end":12.02,"text":"直接拿","representativeFrame":"frames/cues/cue-008.jpg","overlappingShots":["SHOT-003"]},
      {"id":"CUE-009","start":12.5,"end":14.08,"text":"第二步创建Vercel账户","representativeFrame":"frames/cues/cue-009.jpg","overlappingShots":["SHOT-003"]},
      {"id":"CUE-010","start":14.42,"end":15.32,"text":"用Github登录","representativeFrame":"frames/cues/cue-010.jpg","overlappingShots":["SHOT-004"]},
      {"id":"CUE-011","start":15.7,"end":17.02,"text":"在这个网页上拉到下面","representativeFrame":"frames/cues/cue-011.jpg","overlappingShots":["SHOT-004"]},
      {"id":"CUE-012","start":17.02,"end":18.78,"text":"三角形使用Vercel部署","representativeFrame":"frames/cues/cue-012.jpg","overlappingShots":["SHOT-004"]},
      {"id":"CUE-013","start":18.78,"end":20.04,"text":"跳转过来环境变量","representativeFrame":"frames/cues/cue-013.jpg","overlappingShots":["SHOT-004"]},
      {"id":"CUE-014","start":20.04,"end":21.88,"text":"把刚才谷歌的API捡贴进去","representativeFrame":"frames/cues/cue-014.jpg","overlappingShots":["SHOT-004"]},
      {"id":"CUE-015","start":22.34,"end":23.14,"text":"等待一会儿","representativeFrame":"frames/cues/cue-015.jpg","overlappingShots":["SHOT-004"]},
      {"id":"CUE-016","start":23.14,"end":24.24,"text":"会部署成功了","representativeFrame":"frames/cues/cue-016.jpg","overlappingShots":["SHOT-004"]},
      {"id":"CUE-017","start":24.24,"end":26.34,"text":"这样就可以免费使用GPT4了","representativeFrame":"frames/cues/cue-017.jpg","overlappingShots":["SHOT-004"]},
      {"id":"CUE-018","start":26.84,"end":28.6,"text":"如果还嫌麻烦那可以评论区留言","representativeFrame":"frames/cues/cue-018.jpg","overlappingShots":["SHOT-004"]},
      {"id":"CUE-019","start":28.6,"end":30.62,"text":"我把我部署好的发给兄弟们吧","representativeFrame":"frames/cues/cue-019.jpg","overlappingShots":["SHOT-004"]},
      {"id":"CUE-020","start":30.62,"end":32.02,"text":"我是塞伯亚Candy老师","representativeFrame":"frames/cues/cue-020.jpg","overlappingShots":["SHOT-004"]},
      {"id":"CUE-021","start":32.02,"end":34.58,"text":"在AI星级中一路为您银行","representativeFrame":"frames/cues/cue-021.jpg","overlappingShots":["SHOT-004","SHOT-005"]}
    ]
  },
  "knowledgeUnits": [
    {
      "id":"KU-01","title":"开头的主承诺","importance":"core","statement":"作者承诺教观众‘白嫖GPT4模型’，并把方法表述为本地部署 Gemini。","provenance":"author_claim","timeRange":{"start":0,"end":2.88},"evidence":[{"refType":"cue","ref":"CUE-001","supports":"机器转写保留‘白嫖GPT4模型’原话"},{"refType":"source","ref":"DS-005","supports":"HR-001/OCR-00011 与 OCR-00012 显示封面‘一分钟学会本地部署Gemini / 免费使用GPT4模型’"}],"confidence":"high","argument":{"claim":"本地部署 Gemini 可以让观众免费使用 GPT-4 模型","evidenceUnitIds":["KU-16","KU-17","KU-19"],"conditions":[],"counterexamples":[],"actions":["继续观看部署步骤"],"limits":["视频后续可见身份为 Gemini Pro Chat / GeminiPro API，不是后端 GPT-4 的证明"]},"unknowns":["‘白嫖’对应的费用、额度与服务条款"]
    },
    {
      "id":"KU-02","title":"品牌蒙太奇的可信度借位","importance":"supporting","statement":"开头用 data centers、best in class 和多次 Gemini 标识的宣传式画面建立科技/官方感，但素材来源、授权和与后续仓库的直接关系没有建立。","provenance":"visual_observation","timeRange":{"start":0.4,"end":4.8},"evidence":[{"refType":"targeted_frame","ref":"TARGET-0004","supports":"画面可见 data centers"},{"refType":"targeted_frame","ref":"TARGET-0010","supports":"画面可见 Gemini 标识"}],"confidence":"high","unknowns":["素材来源","授权","是否为 Google 官方片段","与后续部署项目的因果关系"]
    },
    {
      "id":"KU-03","title":"低门槛与耗时承诺","importance":"core","statement":"作者声称过程不难、‘一分钟的事’，小白也可以完成。","provenance":"author_claim","timeRange":{"start":2.88,"end":5.12},"evidence":[{"refType":"cue","ref":"CUE-003","supports":"‘别怕难’"},{"refType":"cue","ref":"CUE-004","supports":"‘一分钟的事小白也可以’"},{"refType":"ocr","ref":"OCR-00046","supports":"烧录字幕显示‘别怕难一分钟的事儿’"}],"confidence":"high","argument":{"claim":"部署仅需一分钟且适合小白","evidenceUnitIds":["KU-25"],"conditions":[],"counterexamples":[],"actions":["按视频步骤操作"],"limits":["视频时长约35秒，不等于真实部署耗时","登录、授权、仓库准备和构建时间未计时"]},"unknowns":["真实操作耗时","新用户是否可在一分钟内完成"]
    },
    {
      "id":"KU-04","title":"成本与网络条件主张","importance":"core","statement":"作者声称按此方法‘再也不要魔法和20美刀了’。","provenance":"author_claim","timeRange":{"start":5.12,"end":6.86},"evidence":[{"refType":"cue","ref":"CUE-005","supports":"机器转写原话"},{"refType":"ocr","ref":"OCR-00066","supports":"烧录字幕清晰显示‘再也不要魔法和20美刀了’"}],"confidence":"high","argument":{"claim":"方法不再需要作者口中的‘魔法’和20美元","evidenceUnitIds":["KU-13","KU-27"],"conditions":[],"counterexamples":["README 随后出现‘API 使用不支持用户位置’的解决方案"],"actions":["改走作者展示的部署路径"],"limits":["‘魔法’未定义","地区、网络、API 配额与 Vercel 条件未说明"]},"unknowns":["‘魔法’的具体含义","20美元对应哪项产品/计划"]
    },
    {
      "id":"KU-05","title":"第一步：获取 API 密钥","importance":"core","statement":"作者把第一步定义为获取 API 密钥，并称 Google 的‘双子星模型密钥’对大众开放，可以直接拿。","provenance":"author_claim","timeRange":{"start":7.4,"end":12.02},"evidence":[{"refType":"cue","ref":"CUE-006","supports":"第一步名称"},{"refType":"cue","ref":"CUE-007","supports":"对大众开放的主张"},{"refType":"cue","ref":"CUE-008","supports":"‘直接拿’"}],"confidence":"high","argument":{"claim":"该 API key 对大众开放且可直接取得","evidenceUnitIds":["KU-06","KU-07"],"conditions":[],"counterexamples":[],"actions":["在页面创建/取得 API key"],"limits":["可见页面同时提示公共预览和不支持生产应用","未说明地区、账户、配额或计费条件"]},"unknowns":["‘大众开放’的精确资格和当前有效性"]
    },
    {
      "id":"KU-06","title":"API 页面可见身份与免责声明","importance":"core","statement":"页面标题为‘API 密钥’，正文明确提到 Google AI Studio、Google Cloud 项目和 Google Cloud Platform 服务条款；还写着 Gemini API 目前为公共预览版、尚不支持生产应用程序。","provenance":"visual_observation","timeRange":{"start":6.4,"end":11.6},"evidence":[{"refType":"source","ref":"DS-005","supports":"HR-002/OCR-00024~00026 与 HR-003/OCR-00049~00051 记录 Google AI Studio、Cloud 项目、服务条款、公共预览和不支持生产应用"}],"confidence":"high","unknowns":["页面 URL","账号/地区状态","该免责声明在发布后是否变化"]
    },
    {
      "id":"KU-07","title":"生成密钥弹窗与复制入口","importance":"core","statement":"画面显示‘生成的 API 密钥’弹窗、一个长密钥字符串和‘复制’按钮；重建不复述密钥值。单帧能证明这些元素可见，不能证明复制动作已经执行。","provenance":"visual_observation","timeRange":{"start":7.4,"end":12.5},"evidence":[{"refType":"source","ref":"DS-005","supports":"HR-003/OCR-00055~00060 和 HR-004/OCR-00080~00085 显示生成密钥、字符串和复制按钮"},{"refType":"targeted_frame","ref":"TARGET-0042","supports":"11.6秒弹窗状态"}],"confidence":"high","unknowns":["密钥是否实际复制","密钥是否有效/安全","密钥属于哪个账户或项目"]
    },
    {
      "id":"KU-08","title":"第二步：创建 Vercel 账户","importance":"core","statement":"作者把第二步定义为创建 Vercel 账户；画面展示计划类型中的个人/商业用途选项和姓名输入框。","provenance":"visual_observation","timeRange":{"start":12.5,"end":14.42},"evidence":[{"refType":"cue","ref":"CUE-009","supports":"作者叙述第二步"},{"refType":"source","ref":"DS-005","supports":"HR-005/OCR-00099~00107 显示 Vercel 账户、计划类型、个人/商业项目与姓名字段"}],"confidence":"high","unknowns":["用户是否为新建账户","姓名字段是否真实身份","计划选择后的费用条件"]
    },
    {